6.233.983-2;Blanca Constanza Rodríguez Vergara;FEMENINO;1969/2/25;56;E;8275096;6.81
9.339.591-9;Felipe Felipe Campos Quiroga;MASCULINO;1963/10/19;62;E;3028344;2.91
10.167.046-2;Victoria Victoria Quiroga López;FEMENINO;1963/7/18;62;D;3193850;3.7
8.06.369-5;;MASCULINO;1966/10/26;59;B;1945536;6.69
11.104.672-9;Pamela María Ruiz Robles;FEMENINO;1974/9/0;51;C;843576;6.81
13.803.519-0;Francisco Bernardo Ruiz Campos;MASCULINO;1978/5/21;47;E;7854833;2.7
8.263.340-4;Isidora María Ruiz Vergara;FEMENINO;1995/1/11;30;E;2589317;7.3
15.126.836-8;Constanza Javiera Rodríguez Valenzuela;FEMENINO;1979/8/25;46;D;2120865;5.32
15.895.425-1;Pedro Pablo Valenzuela Vergara;MASCULINO;1972/1/0;53;E;3638921;3.85
20.827.769-7;Andrés Bernardo Rojas Valenzuela;MASCULINO;1993/11/27;32;B;8607961;1.37
15.383.382-8;Juan Felipe Saavedra Marín;MASCULINO;1967/12/2;58;D;2490698;4.34
8.760.058-9;Bernardo Pablo Quiroga Saavedra;MASCULINO;1987/8/23;38;C;6026320;3.48
8.055.706-7;Pamela Isidora Rodríguez Robles;FEMENINO;1966/5/8;59;D;5649942;7.67
7.041.158-2;Blanca Daniela Rojas Díaz;FEMENINO;1985/12/21;40;E;2978210;8.13
15.916.334-6;Gabriel Vicente Rodríguez Quiroga;MASCULINO;1967/1/16;58;B;8257428;8.88
13.415.454-4;Isidora Paula Castro Rodríguez;FEMENINO;1970/8/28;55;A;9014313;5.24
5.112.972-7;Pamela Pamela González González;FEMENINO;1992/1/9;33;A;9494890;9.92
13.686.392-2;Ignacia Paula Rojas Díaz;FEMENINO;1996/11/9;29;E;6488309;9.74
11.398.819-0;Pedro Francisco Saavedra González;MASCULINO;1970/10/15;55;C;8525239;5.68
6.959.981-9;Vicente Juan Vergara Quiroga;MASCULINO;1989/6/22;36;D;3948103;0.05
20.199.726-5;Vicente Pedro Rodríguez Díaz;MASCULINO;2000/1/25;25;A;7991565;6.49
18.764.662-8;Cecilia Pamela Díaz González;FEMENINO;1960/6/12;65;D;5190524;1.44
4.611.708-5;Vicente Ramón López Vergara;MASCULINO;1977/2/12;48;D;1048792;4.43
18.223.185-8;Andrea Ignacia Ruiz Robles;FEMENINO;1961/2/28;64;D;4441060;4.56
14.143.949-6;Pedro Juan Muñoz Campos;MASCULINO;1986/11/14;39;C;3594270;4.93
7.788.883-5;Cecilia Isabel Muñoz López;FEMENINO;1961/6/30;64;C;6334409;2.21
5.837.844-1;Victoria Pamela Valenzuela Valenzuela;FEMENINO;1973/12/8;52;C;5477339;9.68
19.676.888-8;;MASCULINO;1981/11/0;44;C;2858444;6.19
11.305.947-4;Victoria Valeria Ruiz Campos;FEMENINO;1968/5/21;57;D;1593537;5.33
20.280.802-2;Juan Gabriel Saavedra Campos;MASCULINO;1995/11/8;30;C;1905307;1.64
7.195.272-5;Alejandro Alejandro Quiroga López;MASCULINO;1980/12/16;45;D;1061167;9.28
5.839.624-3;Isabel Cecilia Valenzuela Marín;FEMENINO;1978/2/2;47;B;8765150;9.93
20.993.990-7;Isabel Pamela Robles Valenzuela;FEMENINO;1975/6/18;50;E;9856692;8.02
6.636.644-4;Andrea Cecilia Rodríguez Rojas;FEMENINO;1982/10/13;43;A;8004438;9.44
20.165.736-0;Felipe Alejandro López Marín;MASCULINO;1989/12/4;36;C;4560345;8.85
19.328.675-3;Isabel Pamela Valenzuela Quiroga;FEMENINO;1975/6/0;50;C;9037412;8.38
20.354.300-4;Juan Bernardo Rojas Saavedra;MASCULINO;1991/10/0;34;B;1184598;5.63
9.485.914-2;Juan Gabriel Quiroga Saavedra;MASCULINO;1982/5/3;43;E;2452305;9.63
11.725.461-6;Cecilia Isidora Saavedra González;FEMENINO;1974/4/29;51;A;968146;9.54
12.805.845-3;Ramón Pedro Rodríguez Rojas;MASCULINO;2000/5/20;25;A;279165;9.68
6.902.316-1;Isidora Victoria Rodríguez Marín;FEMENINO;1977/1/0;48;A;1580876;4.87
10.624.652-5;Daniela Isidora Rojas López;FEMENINO;1974/9/6;51;C;1275726;6.29
14.170.130-0;Isidora Cecilia Campos Rodríguez;FEMENINO;1980/8/10;45;D;1855931;8.5
17.612.09-2;Javier Ramón Ruiz Campos;MASCULINO;1964/3/23;61;D;563669;2.74
12.681.880-8;Victoria Valeria Vergara Díaz;FEMENINO;1994/7/25;31;D;2834083;6.66
16.922.047-8;Ramón Pablo Rodríguez González;MASCULINO;1960/6/18;65;D;7958615;7.0
10.805.234-6;Cecilia María López Rodríguez;FEMENINO;1991/11/1;34;E;4991414;2.37
8.578.750-4;Bernardo Francisco Ruiz González;MASCULINO;1982/7/23;43;D;2302561;3.13
19.566.355-2;Gabriel Alejandro Marín Quiroga;MASCULINO;1971/7/5;54;E;4082866;9.19
14.076.796-2;Ignacio Javier Campos López;MASCULINO;1974/7/26;51;A;8471340;5.96
20.769.601-2;Gabriel Bernardo Castro Rodríguez;MASCULINO;1992/5/1;33;B;6112672;3.56
8.796.602-3;Felipe Rodrigo Díaz Vergara;MASCULINO;1982/1/24;43;D;8311590;2.26
7.825.595-3;Javiera Victoria Vergara Quiroga;FEMENINO;1961/7/5;64;C;3752379;8.88
18.675.065-1;Bernardo Pablo López Ruiz;MASCULINO;1994/6/6;31;B;9551294;9.01
21.713.197-7;Juan Alejandro González Campos;MASCULINO;1987/2/4;38;B;727903;5.75
19.918.013-2;Andrés Gabriel Muñoz Rojas;MASCULINO;1983/5/6;42;E;9851041;2.98
19.310.027-1;Cecilia Victoria Rodríguez Campos;FEMENINO;1992/1/16;33;E;6294320;6.18
6.810.010-4;Valeria Paula Marín Rodríguez;FEMENINO;1987/8/13;38;A;1887122;3.34
7.150.882-3;Pablo Juan Quiroga López;MASCULINO;1962/11/12;63;C;8426339;9.86
16.517.904-2;Isidora Constanza Rodríguez Rojas;FEMENINO;1973/12/15;52;E;3263029;2.36
8.260.680-3;María Javiera Díaz Rodríguez;FEMENINO;1991/2/22;34;A;7330342;4.72
12.628.437-7;Juan Francisco Valenzuela Ruiz;MASCULINO;1962/4/7;63;D;1896496;5.81
21.400.772-9;Constanza María López Rodríguez;FEMENINO;1973/7/5;52;D;9609165;8.08
10.357.508-0;;MASCULINO;1962/4/16;63;D;8994447;3.14
10.986.889-8;Constanza Ignacia Quiroga Robles;FEMENINO;1981/2/11;44;C;9059887;9.08
7.286.356-5;Javiera Cecilia González Díaz;FEMENINO;1961/2/26;64;A;7491189;5.92
8.716.460-1;Gabriel Felipe Saavedra Valenzuela;MASCULINO;1992/2/21;33;E;8405711;6.38
4.518.675-9;Pedro Rodrigo Rodríguez Marín;MASCULINO;1997/7/0;28;C;3013550;6.67
10.326.473-6;Andrés Francisco Valenzuela López;MASCULINO;1975/1/22;50;C;106970;8.96
9.441.413-3;Alejandro Rodrigo Valenzuela Campos;MASCULINO;1992/5/17;33;A;3823952;6.51
9.576.107-9;Victoria Javiera Muñoz Quiroga;FEMENINO;1972/5/25;53;B;1280662;1.37
18.719.646-1;Constanza Victoria Vergara Quiroga;FEMENINO;1997/9/12;28;A;3458693;7.6
14.021.178-3;;FEMENINO;1990/11/17;35;E;6913309;7.27
8.404.442-8;Pamela Blanca González Vergara;FEMENINO;1990/12/20;35;D;2216365;5.89
9.887.156-1;Ramón Alejandro Saavedra Muñoz;MASCULINO;1993/7/24;32;B;4449314;2.06
18.830.837-2;Juan Felipe Castro Robles;MASCULINO;1965/11/3;60;E;1413835;4.9
21.735.998-8;Bernardo Gabriel Díaz Rodríguez;MASCULINO;1987/6/3;38;C;8912224;1.84
19.960.363-4;Francisco Juan Díaz Rojas;MASCULINO;1991/8/0;34;A;7475587;2.14
9.263.424-8;Pablo Rodrigo Vergara Quiroga;MASCULINO;1981/2/8;44;E;8698248;5.45
20.555.830-0;Javier Gabriel Rodríguez Rodríguez;MASCULINO;1964/2/24;61;D;2573436;3.54
8.255.103-1;Constanza Isidora Rodríguez López;FEMENINO;1983/8/6;42;E;4955668;7.75
21.408.764-5;Cecilia Blanca Marín Rodríguez;FEMENINO;1969/7/8;56;A;6155641;8.38
12.058.680-2;Alejandro Pedro Saavedra Muñoz;MASCULINO;1990/1/25;35;A;5257661;2.55
7.763.310-5;Gabriel Francisco Campos López;MASCULINO;1995/7/15;30;B;1824635;2.43
8.842.805-9;Paula Valeria Muñoz González;FEMENINO;1962/8/24;63;D;6668705;9.95
18.730.895-6;Paula Daniela Campos Rodríguez;FEMENINO;1990/7/11;35;A;1608095;4.84
12.768.135-6;Ramón Juan Rodríguez Rodríguez;MASCULINO;1995/11/2;30;D;3776123;2.91
12.01.996-4;Blanca Paula Quiroga Rojas;FEMENINO;1996/12/28;29;A;7093889;0.32
20.936.599-0;Alejandro Vicente Muñoz Rodríguez;MASCULINO;1999/7/30;26;B;8879366;2.76
21.260.653-9;Paula Ignacia Vergara Ruiz;FEMENINO;1993/3/19;32;B;2111007;6.28
9.528.197-7;Pamela Valeria Quiroga Rodríguez;FEMENINO;1981/7/21;44;A;3641904;9.58
20.028.634-8;Vicente Rodrigo Quiroga Saavedra;MASCULINO;1989/7/15;36;C;7498365;2.37
18.243.340-0;Alejandro Gabriel Castro Campos;MASCULINO;1977/6/10;48;B;4000047;8.47
14.536.851-2;Isabel Cecilia Marín Marín;FEMENINO;1993/9/16;32;C;2065257;0.71
9.703.972-2;Isidora Isidora Ruiz Rodríguez;FEMENINO;1994/9/30;31;D;4823812;9.74
11.310.180-9;Cecilia Ignacia Rodríguez Saavedra;FEMENINO;1985/7/26;40;C;5027206;8.81
17.442.341-4;Valeria Constanza Campos Robles;FEMENINO;1965/3/1;60;A;2374216;0.2
13.276.138-0;Constanza Isidora Marín Robles;FEMENINO;1967/12/26;58;A;7439652;6.25
16.550.145-1;;MASCULINO;1974/1/30;51;D;3394212;0.15
5.286.678-4;Felipe Andrés Castro Díaz;MASCULINO;1992/5/11;33;E;5856488;5.91
16.890.332-8;Vicente Francisco Saavedra Quiroga;MASCULINO;1965/10/16;60;D;7728540;8.17
17.629.811-9;Felipe Bernardo Díaz Valenzuela;MASCULINO;1978/10/19;47;A;9372511;3.26
13.182.885-9;María Valeria Muñoz Valenzuela;FEMENINO;1978/2/4;47;E;7280301;4.02
7.241.788-0;Rodrigo Gabriel Saavedra Marín;MASCULINO;1999/11/9;26;A;7581630;0.7
21.288.237-5;;FEMENINO;1965/10/20;60;E;5440528;4.39
14.062.351-0;Javier Juan Robles Rojas;MASCULINO;1982/4/17;43;A;2683227;2.73
21.196.577-9;Vicente Pedro Ruiz Marín;MASCULINO;1970/7/10;55;C;4839114;3.04
4.726.529-8;Isabel Pamela Valenzuela Rojas;FEMENINO;1961/1/28;64;B;3572000;0.05
21.590.988-9;Felipe Juan Quiroga Saavedra;MASCULINO;1998/11/24;27;C;5219668;0.37
9.312.898-0;Francisco Vicente Saavedra Valenzuela;MASCULINO;1979/4/25;46;A;1665687;6.92
10.864.948-4;;FEMENINO;1960/4/26;65;E;5232315;9.76
8.595.547-6;Constanza Javiera Valenzuela Campos;FEMENINO;1981/12/1;44;D;4374224;6.57
20.168.238-0;Rodrigo Francisco Díaz Campos;MASCULINO;1988/1/4;37;C;9907126;8.53
16.534.753-0;María Daniela López Campos;FEMENINO;1979/9/23;46;C;5191176;5.32
11.910.304-2;Daniela Constanza Rojas Rodríguez;FEMENINO;1975/3/2;50;C;7142462;8.15
11.374.035-8;Javiera Ignacia Ruiz Muñoz;FEMENINO;1987/1/5;38;A;9681620;4.61
11.721.866-9;Ramón Gabriel Castro Rodríguez;MASCULINO;1985/11/30;40;A;1476699;1.84
4.278.920-4;Rodrigo Ignacio Rojas Campos;MASCULINO;1981/1/7;44;A;615497;5.34
9.489.011-5;Constanza Javiera Quiroga Rodríguez;FEMENINO;1983/7/16;42;E;4380231;5.54
10.469.027-3;Rodrigo Pablo Castro Marín;MASCULINO;1987/6/12;38;D;1935873;8.39
10.284.599-9;Valeria Isidora Vergara Vergara;FEMENINO;1986/1/16;39;C;8507134;2.47
18.056.355-8;Blanca Daniela Saavedra Ruiz;FEMENINO;2000/4/9;25;A;5986045;1.44
6.438.937-2;Francisco Francisco Díaz Valenzuela;MASCULINO;1963/6/16;62;C;7999356;0.25
14.604.107-1;Vicente Ignacio Ruiz Valenzuela;MASCULINO;1984/7/10;41;A;100414;6.32
20.797.656-9;Vicente Pedro Díaz Vergara;MASCULINO;1979/1/14;46;D;3714915;8.59
16.467.353-7;Cecilia Blanca Rodríguez Quiroga;FEMENINO;1998/2/25;27;D;8827085;3.85
19.400.477-1;;MASCULINO;1964/10/25;61;B;1872152;8.49
11.084.212-3;Pablo Andrés Rodríguez Rojas;MASCULINO;1965/10/28;60;D;7326259;8.95
8.240.259-9;Daniela Andrea López Muñoz;FEMENINO;2000/8/10;25;D;9555149;7.29
11.755.815-7;Pedro Pablo Muñoz Rodríguez;MASCULINO;1989/2/17;36;A;7367917;9.02
9.048.496-9;Andrea Javiera Díaz Rodríguez;FEMENINO;1976/11/12;49;C;864017;5.35
13.336.071-6;María Ignacia Rodríguez Rodríguez;FEMENINO;1980/3/22;45;B;3748666;5.32
4.639.610-1;;MASCULINO;1964/7/12;61;A;3725120;1.14
9.137.804-9;Juan Vicente Rojas Campos;MASCULINO;1961/7/15;64;C;6798312;0.44
20.889.271-0;Javiera Paula Ruiz Ruiz;FEMENINO;1965/6/1;60;D;2827166;9.19
11.701.888-4;María Ignacia Ruiz Rodríguez;FEMENINO;1978/9/22;47;C;8603305;2.11
6.033.213-4;Blanca Javiera Saavedra López;FEMENINO;1975/4/0;50;B;7546922;4.63
8.644.856-1;Ignacia Isidora Quiroga Castro;FEMENINO;1976/5/16;49;B;4214252;0.8
17.819.758-3;Felipe Andrés Marín Muñoz;MASCULINO;1973/7/18;52;B;9805050;4.27
4.071.609-5;Javiera Valeria Saavedra Vergara;FEMENINO;1962/11/13;63;A;6589421;2.59
14.051.557-2;Ramón Bernardo Quiroga Valenzuela;MASCULINO;1983/6/0;42;C;6543036;1.72
10.073.580-2;Ignacio Vicente Rodríguez Castro;MASCULINO;1962/6/19;63;C;5540700;0.22
11.122.389-2;Ramón Gabriel Castro Castro;MASCULINO;1965/1/1;60;C;3668022;9.18
14.617.136-2;Andrés Francisco Quiroga Rodríguez;MASCULINO;1972/2/2;53;D;2658738;6.82
16.956.560-7;Daniela Isidora Rodríguez Robles;FEMENINO;1994/6/14;31;E;6263441;2.55
16.201.597-9;;FEMENINO;1965/7/14;60;D;4330896;1.44
20.995.222-8;Ignacio Gabriel Robles Campos;MASCULINO;1963/12/27;62;B;5892903;9.24
18.826.925-7;Bernardo Alejandro Rodríguez Ruiz;MASCULINO;1984/12/25;41;E;3129611;3.76
13.994.337-5;Constanza Cecilia Rodríguez Muñoz;FEMENINO;1983/3/3;42;B;5948838;8.73
7.997.983-0;Constanza Cecilia Saavedra Díaz;FEMENINO;1960/3/13;65;C;16038;1.95
6.473.576-8;Ignacia María Rodríguez Campos;FEMENINO;1967/4/28;58;B;8244213;2.24
13.711.127-4;Pedro Francisco Rodríguez Muñoz;MASCULINO;1963/1/16;62;A;2358661;0.39
8.309.200-8;Javier Pedro González Vergara;MASCULINO;1962/4/8;63;B;9683334;4.47
7.264.019-5;Bernardo Ignacio López Rodríguez;MASCULINO;1965/3/23;60;B;7713902;8.29
21.165.055-9;Ramón Javier Rodríguez Rodríguez;MASCULINO;1992/1/0;33;C;4959700;7.08
15.075.537-6;Gabriel Pedro Robles Campos;MASCULINO;1974/2/18;51;D;216518;2.98
11.724.025-5;Ignacia Blanca Vergara Castro;FEMENINO;1982/7/21;43;E;3053277;1.37
17.897.149-4;Blanca Constanza Quiroga Rodríguez;FEMENINO;1975/8/24;50;B;888081;8.36
15.011.079-2;Pamela María Vergara Saavedra;FEMENINO;1984/12/22;41;D;1290361;2.97
4.557.274-4;Ignacio Alejandro Quiroga Rodríguez;MASCULINO;1976/10/22;49;D;6169834;9.66
13.388.535-0;Bernardo Pedro Quiroga González;MASCULINO;1979/8/20;46;B;8289372;7.93
16.073.959-0;;FEMENINO;1961/10/21;64;E;8227245;2.16
20.895.919-3;Pablo Pablo Robles Castro;MASCULINO;1990/8/30;35;E;2030606;0.18
5.936.080-6;Felipe Pablo González González;MASCULINO;1978/9/8;47;D;8511519;9.32
18.726.623-8;Ignacio Gabriel Rodríguez Rodríguez;MASCULINO;1962/12/27;63;E;7388202;8.82
13.701.895-9;Pedro Vicente Marín Rodríguez;MASCULINO;1992/7/12;33;E;4237081;0.88
5.640.047-8;;FEMENINO;1982/11/9;43;B;743618;4.83
4.968.804-9;Andrés Bernardo Díaz Valenzuela;MASCULINO;1969/4/10;56;E;9149240;2.71
7.837.896-9;Pablo Felipe Quiroga Valenzuela;MASCULINO;1986/7/5;39;A;4273371;7.34
12.874.644-9;Andrés Pablo Marín Saavedra;MASCULINO;1970/6/27;55;B;5358447;1.48
19.228.770-8;Cecilia Blanca López Campos;FEMENINO;1998/3/12;27;D;1574943;3.67
12.567.626-1;Victoria Pamela Quiroga Castro;FEMENINO;1968/8/7;57;D;8513239;5.23
17.294.459-9;Francisco Bernardo Rodríguez Rojas;MASCULINO;1979/9/2;46;B;8116631;1.81
18.650.823-6;Pedro Felipe Rojas Quiroga;MASCULINO;1971/7/26;54;B;312675;9.86
21.803.719-5;Pablo Pedro Saavedra Robles;MASCULINO;1985/11/3;40;A;9772999;2.27
12.758.425-9;Ramón Pedro Quiroga Rodríguez;MASCULINO;1960/12/14;65;A;269221;4.28
20.741.523-2;Juan Javier Vergara Muñoz;MASCULINO;1986/9/11;39;B;6862141;3.33
9.377.785-3;Ignacio Alejandro González Marín;MASCULINO;1998/8/3;27;B;5480321;4.31
4.178.518-2;Daniela Paula Valenzuela Ruiz;FEMENINO;1964/9/19;61;A;4417010;1.49
9.230.596-0;;FEMENINO;1981/11/29;44;C;4946242;2.2
5.284.707-3;Vicente Gabriel López Muñoz;MASCULINO;1992/4/25;33;D;3166173;3.29
4.718.482-9;Constanza Paula Marín Castro;FEMENINO;1970/7/11;55;E;1775436;1.6
12.128.652-9;María Paula Vergara Rodríguez;FEMENINO;1968/12/24;57;C;2133502;4.27
14.486.141-0;Alejandro Bernardo González Quiroga;MASCULINO;1966/8/20;59;D;6773561;8.12
18.130.270-4;Bernardo Andrés Díaz Castro;MASCULINO;1978/11/17;47;C;672766;5.36
17.065.304-0;Isabel Pamela Rodríguez Robles;FEMENINO;1974/8/10;51;E;1532240;1.08
17.951.144-8;Ignacio Alejandro Vergara López;MASCULINO;1981/12/16;44;C;2353156;7.84
6.899.537-2;;MASCULINO;1967/12/1;58;D;7729838;4.57
19.866.784-3;Pamela Victoria Robles Quiroga;FEMENINO;1983/10/23;42;B;1873574;4.96
13.089.993-1;Victoria Isidora Valenzuela Vergara;FEMENINO;1985/12/25;40;B;2575096;8.42
20.545.632-3;Andrés Andrés Saavedra Rodríguez;MASCULINO;1977/12/21;48;B;141303;9.17
21.437.051-9;Alejandro Ignacio Díaz López;MASCULINO;1998/4/26;27;C;5450728;7.37
21.498.155-4;Pedro Alejandro Robles Castro;MASCULINO;1998/12/28;27;C;733391;8.39
20.850.143-5;Isabel Isidora Castro Robles;FEMENINO;1974/8/2;51;C;9234320;5.33
6.755.569-9;Bernardo Javier Rodríguez Vergara;MASCULINO;1982/7/24;43;A;8293370;0.96
17.696.691-2;María Ignacia López Rodríguez;FEMENINO;1981/12/17;44;A;7526458;0.89
20.881.724-4;Gabriel Gabriel Robles Muñoz;MASCULINO;1979/4/5;46;D;7817032;1.43
7.414.364-4;Felipe Ignacio Robles Valenzuela;MASCULINO;1960/7/14;65;C;2092825;4.38
8.821.372-5;María María Rodríguez Ruiz;FEMENINO;1966/9/6;59;A;2936129;0.48
7.763.913-1;;FEMENINO;1966/11/8;59;A;2083204;8.28
11.909.542-0;Bernardo Bernardo Castro Rodríguez;MASCULINO;1973/11/27;52;B;4370123;0.95
16.093.611-3;Gabriel Ignacio Campos Marín;MASCULINO;1960/7/17;65;C;7853384;8.84
14.477.330-4;Pablo Rodrigo Rodríguez Rodríguez;MASCULINO;1975/3/22;50;C;4537412;1.59
19.981.182-0;Victoria Isabel Muñoz Marín;FEMENINO;1979/8/21;46;A;3783046;0.21
17.799.550-5;Andrea Valeria Robles Vergara;FEMENINO;1962/3/9;63;C;5213683;3.21
9.651.873-9;Felipe Andrés Campos Rodríguez;MASCULINO;1980/2/22;45;B;8743380;5.48
14.233.142-7;Pedro Vicente Marín Castro;MASCULINO;1961/3/26;64;D;998917;6.72
4.713.154-5;Isidora Isidora Díaz Muñoz;FEMENINO;1995/12/7;30;D;2167781;6.52
20.878.778-8;Paula María Campos Robles;FEMENINO;1986/4/28;39;A;6472122;5.9
13.170.501-5;Isabel Ignacia Campos Castro;FEMENINO;1998/12/14;27;A;9552393;3.04
18.574.675-3;Victoria Valeria Marín Campos;FEMENINO;1989/4/20;36;B;663407;2.31
17.658.158-2;Isabel Ignacia Quiroga Saavedra;FEMENINO;1992/6/17;33;B;2178140;5.32
8.656.839-8;Pedro Pablo Muñoz Quiroga;MASCULINO;1965/6/11;60;B;5902389;3.99
21.845.232-9;Ignacio Javier Castro Valenzuela;MASCULINO;1979/6/16;46;D;3088485;2.96
5.488.756-2;Pablo Ignacio Muñoz Marín;MASCULINO;1969/5/29;56;C;8859216;9.75
6.258.039-4;Isidora María Saavedra Muñoz;FEMENINO;1962/1/3;63;E;1375327;8.1
8.289.187-5;Javier Javier Robles Díaz;MASCULINO;1982/5/2;43;A;4594583;4.35
11.184.273-7;Ignacio Rodrigo Castro Campos;MASCULINO;1992/7/26;33;D;1182637;3.96
12.841.176-0;Pablo Andrés Campos Robles;MASCULINO;1983/1/12;42;C;2957844;4.22
21.538.875-8;Francisco Felipe Robles Castro;MASCULINO;1986/10/11;39;A;6669171;8.2
14.024.091-2;Gabriel Pedro Ruiz González;MASCULINO;1961/9/5;64;D;5672430;9.46
18.721.134-4;Ignacio Juan Quiroga Rojas;MASCULINO;1972/1/13;53;D;7449851;5.08
20.247.600-5;Andrés Francisco Ruiz Díaz;MASCULINO;2000/10/26;25;C;5886811;1.55
11.146.670-5;Paula Constanza Quiroga Marín;FEMENINO;1962/10/16;63;C;7130837;7.44
10.673.954-2;María Valeria Ruiz Valenzuela;FEMENINO;1978/1/9;47;E;727624;4.34
16.682.179-1;Isabel Victoria Vergara Marín;FEMENINO;1981/4/30;44;B;6484929;4.55
8.165.828-2;Pablo Alejandro Campos Robles;MASCULINO;1984/12/16;41;C;3664685;0.8
19.361.541-5;Valeria Constanza Saavedra Ruiz;FEMENINO;1978/8/25;47;A;6404089;8.85
4.934.488-2;Francisco Andrés Rodríguez Vergara;MASCULINO;1962/10/15;63;A;2312232;1.77
11.552.729-2;Isidora María Quiroga Valenzuela;FEMENINO;1964/10/3;61;B;4332702;9.66
21.718.08-4;Pedro Pedro López González;MASCULINO;1966/6/4;59;B;1165390;2.94
20.716.092-3;Ramón Ignacio Quiroga Robles;MASCULINO;1993/4/23;32;C;5092995;3.9
12.634.341-2;Isabel Paula Quiroga Díaz;FEMENINO;1988/7/25;37;B;9099737;4.71
17.787.669-8;Pablo Pablo Saavedra Saavedra;MASCULINO;1987/2/3;38;A;5058869;2.91
21.027.338-6;Victoria Isabel Díaz Quiroga;FEMENINO;1996/2/13;29;C;1076127;1.15
5.896.612-9;Bernardo Ramón López Saavedra;MASCULINO;1964/9/26;61;E;4774114;0.47
13.675.721-5;Victoria María Marín Quiroga;FEMENINO;1972/2/5;53;D;6615298;5.85
4.660.685-5;Constanza Cecilia Ruiz Castro;FEMENINO;1980/4/28;45;B;9431834;0.87
16.284.354-3;;MASCULINO;1988/7/12;37;E;7450819;5.1
10.645.281-1;Victoria Javiera Rodríguez Rodríguez;FEMENINO;1987/7/7;38;D;499833;8.21
18.534.145-6;Gabriel Andrés Muñoz López;MASCULINO;1981/11/17;44;C;5719543;2.58
15.806.815-4;Blanca Constanza Muñoz Ruiz;FEMENINO;1981/1/24;44;E;8705936;1.79
20.076.720-1;Gabriel Pablo Rojas Díaz;MASCULINO;1968/8/16;57;C;3732632;7.13
8.773.766-6;Valeria Andrea Marín Castro;FEMENINO;1960/11/6;65;A;5217341;3.78
11.820.067-4;Paula Victoria Rodríguez Ruiz;FEMENINO;1988/4/18;37;D;2533044;3.08
15.690.714-6;Daniela Javiera Robles Quiroga;FEMENINO;1983/7/9;42;E;1225160;0.4
5.875.875-1;Victoria Valeria Quiroga Rodríguez;FEMENINO;1986/7/19;39;B;2498849;5.62
9.508.801-2;Isidora Isabel Rodríguez Campos;FEMENINO;1989/12/3;36;B;5971739;4.67
12.700.668-8;Ramón Gabriel González Muñoz;MASCULINO;1981/12/13;44;C;5331485;9.55
4.636.531-1;Andrea Constanza Vergara Rodríguez;FEMENINO;1983/9/18;42;D;1262800;8.42
20.045.888-2;Andrea Cecilia Valenzuela Rodríguez;FEMENINO;1988/2/20;37;C;5693996;1.25
21.681.310-8;Vicente Pablo Ruiz Castro;MASCULINO;1964/12/9;61;D;4821667;0.9
7.286.940-2;Felipe Rodrigo Vergara Quiroga;MASCULINO;1968/6/14;57;A;3790259;2.38
19.832.798-8;Alejandro Juan Marín Castro;MASCULINO;1978/3/23;47;C;5665056;7.88
12.868.203-0;Pedro Alejandro Rodríguez Quiroga;MASCULINO;1985/7/17;40;A;767462;8.71
15.032.795-2;Andrés Bernardo Vergara Marín;MASCULINO;1979/10/30;46;D;1585150;6.73
14.984.127-1;Pedro Pedro Ruiz Rojas;MASCULINO;1967/2/17;58;B;4082929;4.46
6.261.230-6;Juan Pablo Marín Rodríguez;MASCULINO;1988/8/28;37;A;9200453;4.1
19.764.517-7;Ignacia Ignacia Rodríguez Marín;FEMENINO;1979/6/27;46;A;1673614;1.55
13.169.502-9;Gabriel Felipe Robles Saavedra;MASCULINO;1974/6/28;51;D;8608394;9.17
17.287.757-7;Bernardo Bernardo González Valenzuela;MASCULINO;1966/7/22;59;B;1680835;9.94
16.671.081-8;Bernardo Andrés Campos Saavedra;MASCULINO;1987/11/2;38;E;586350;0.02
13.138.438-8;Alejandro Alejandro Quiroga Rojas;MASCULINO;1988/4/5;37;C;411095;5.17
11.110.437-2;Isabel Pamela Marín López;FEMENINO;1991/8/20;34;A;8911745;3.73
16.424.720-8;Pamela Ignacia Vergara Rodríguez;FEMENINO;1998/9/3;27;C;6661839;8.93
14.491.365-3;Gabriel Ramón Marín Ruiz;MASCULINO;1975/4/15;50;E;3655904;0.75
16.776.574-7;Bernardo Ramón Robles Marín;MASCULINO;1992/5/2;33;C;5615552;8.54
5.962.917-1;Pamela Paula Muñoz Rodríguez;FEMENINO;1964/3/26;61;C;6792601;0.19
13.086.557-1;Valeria Ignacia Castro Rodríguez;FEMENINO;1976/12/2;49;D;4154820;5.01
17.798.655-9;Javiera Constanza Quiroga Rodríguez;FEMENINO;1972/8/0;53;A;9389619;4.33
19.476.556-9;Felipe Pedro Robles Campos;MASCULINO;1992/4/20;33;E;628471;2.29
19.535.903-2;Pablo Pablo Rojas Castro;MASCULINO;1967/4/10;58;C;8399185;1.26
6.466.802-7;Ignacia Paula Valenzuela Muñoz;FEMENINO;1992/8/18;33;B;3451850;5.89
17.645.613-4;Pablo Bernardo Vergara Díaz;MASCULINO;1969/7/30;56;D;2326317;5.89
18.287.162-8;Javier Pablo Robles Quiroga;MASCULINO;1992/2/28;33;A;5444030;6.8
5.311.644-2;Victoria Ignacia Robles Vergara;FEMENINO;1978/9/26;47;C;2614022;8.7
6.101.034-3;Blanca Victoria Saavedra Robles;FEMENINO;1990/7/13;35;E;7184530;1.49
21.459.732-6;;MASCULINO;1986/7/8;39;A;8643460;4.26
16.054.967-6;Javiera Pamela Quiroga Campos;FEMENINO;1965/9/12;60;E;2322113;7.11
18.575.374-8;Pamela Blanca Campos Saavedra;FEMENINO;1963/12/17;62;B;5479699;3.88
21.162.862-7;Cecilia María Campos Rojas;FEMENINO;1978/8/23;47;B;3497375;3.15
5.927.129-4;Constanza Valeria González Saavedra;FEMENINO;1997/4/1;28;A;6135022;1.88
21.358.606-4;Daniela Isabel Saavedra Rodríguez;FEMENINO;1993/4/19;32;B;4233493;6.7
5.839.475-2;Ramón Ramón Campos Campos;MASCULINO;1984/8/27;41;C;4897887;0.22
6.637.556-8;Daniela Victoria Díaz Marín;FEMENINO;1962/4/11;63;D;2068153;5.91
14.733.763-8;Pedro Gabriel Díaz Vergara;MASCULINO;1985/4/19;40;D;3225353;8.83
13.836.927-3;Andrés Felipe Saavedra Rojas;MASCULINO;1983/7/8;42;A;1584310;0.22
11.427.043-9;Isabel Victoria Rojas Campos;FEMENINO;1971/7/8;54;D;1097564;3.69
12.043.235-2;Valeria Andrea Saavedra Díaz;FEMENINO;1960/5/12;65;C;5529823;0.29
21.249.977-0;Paula Andrea Robles Ruiz;FEMENINO;1964/3/3;61;C;8596138;1.38
8.889.016-7;Felipe Rodrigo Marín Rojas;MASCULINO;1988/4/2;37;C;7028126;7.26
9.322.502-2;Isabel Cecilia Campos López;FEMENINO;1971/5/1;54;C;2480665;6.47
9.525.418-1;Isabel Daniela Muñoz Campos;FEMENINO;1962/7/18;63;C;5381148;6.85
9.760.018-0;Cecilia Pamela Muñoz Marín;FEMENINO;1971/4/17;54;A;3084088;2.79
8.484.372-1;Gabriel Ramón López González;MASCULINO;1965/1/25;60;D;8454027;0.96
11.068.815-5;Andrea Isidora Díaz Vergara;FEMENINO;1977/9/10;48;E;4149181;5.65
5.048.796-8;Isabel Victoria Quiroga Rojas;FEMENINO;1974/2/3;51;C;6088998;4.91
19.984.613-6;Pedro Felipe Robles Castro;MASCULINO;1983/12/12;42;C;9031668;4.02
20.266.988-9;Felipe Javier Rodríguez González;MASCULINO;1966/7/15;59;D;8468603;0.74
7.091.949-0;Andrés Bernardo Campos Campos;MASCULINO;1960/12/4;65;C;1388993;6.56
21.905.068-1;Ignacia Daniela Valenzuela Saavedra;FEMENINO;2000/11/8;25;A;2249309;6.22
12.342.014-4;;MASCULINO;1985/9/27;40;A;4796517;0.36
6.983.635-2;Rodrigo Rodrigo Campos Ruiz;MASCULINO;1991/6/11;34;A;8965294;2.68
17.019.755-3;Vicente Vicente Vergara Marín;MASCULINO;1983/9/10;42;C;4682903;8.39
21.537.503-3;Ignacia Cecilia Muñoz Valenzuela;FEMENINO;1995/4/5;30;A;4673068;7.4
14.859.139-5;Cecilia Andrea López Rodríguez;FEMENINO;1984/6/28;41;B;8330682;6.52
12.281.688-7;Isidora Constanza Castro Muñoz;FEMENINO;2000/9/0;25;C;5497927;5.53
6.050.689-3;Pedro Andrés Castro González;MASCULINO;1960/1/16;65;E;550804;5.98
13.694.601-3;Pablo Rodrigo Rojas González;MASCULINO;1969/4/14;56;D;6188785;7.55
11.417.016-6;Daniela Cecilia Castro Saavedra;FEMENINO;1988/9/16;37;C;1265255;4.7
11.061.285-3;Victoria María González Marín;FEMENINO;1962/2/0;63;B;2464673;1.02
10.609.998-7;Paula Valeria Quiroga Rodríguez;FEMENINO;1960/1/2;65;D;5367447;7.27
16.902.565-7;Javier Bernardo Ruiz Marín;MASCULINO;1967/11/6;58;A;5409979;7.18
17.044.643-6;Ignacia Valeria Ruiz Valenzuela;FEMENINO;1961/10/26;64;A;5369130;2.92
15.271.339-7;;FEMENINO;2000/3/3;25;D;6501399;4.87
12.575.611-6;Bernardo Juan González Marín;MASCULINO;1967/4/10;58;B;2049695;8.6
10.514.971-7;Victoria Ignacia Robles Quiroga;FEMENINO;1984/7/30;41;B;2879334;7.55
8.685.331-3;Gabriel Alejandro Quiroga Vergara;MASCULINO;1972/9/30;53;D;4395661;8.58
10.155.886-0;Valeria Daniela Rodríguez Rodríguez;FEMENINO;1973/2/19;52;D;2542031;6.65
15.259.734-1;Cecilia Paula López Rodríguez;FEMENINO;1962/6/27;63;B;3859279;7.62
9.213.579-3;Ignacio Juan Valenzuela González;MASCULINO;1967/11/9;58;C;2886804;7.9
8.102.265-0;Victoria Isabel Díaz Muñoz;FEMENINO;1966/12/2;59;C;9676850;0.06
17.868.067-6;;FEMENINO;1965/10/6;60;C;7354168;0.49
19.465.961-4;Francisco Pedro Valenzuela Marín;MASCULINO;1986/10/26;39;B;3501076;3.96
12.718.179-1;Victoria Cecilia López Rodríguez;FEMENINO;1964/8/26;61;A;5548733;7.25
9.852.679-2;Andrea Victoria Quiroga Díaz;FEMENINO;1975/4/13;50;D;7650326;9.44
