7.671.393-8;Francisco Alejandro Saavedra Campos;MASCULINO;1970/9/17;55;E;7946285;1.28
19.728.489-6;Pamela Pamela Robles Vergara;FEMENINO;1997/12/4;28;E;6042486;3.54
21.524.722-1;Ramón Francisco López Rodríguez;MASCULINO;1981/9/23;44;D;7863922;0.52
20.748.097-8;Pedro Vicente Díaz Quiroga;MASCULINO;1998/10/29;27;A;251115;4.11
13.875.454-6;Daniela Javiera Rojas Quiroga;FEMENINO;1970/7/16;55;C;9169694;4.99
6.574.835-8;Paula Isidora Marín Díaz;FEMENINO;1976/9/11;49;E;7980370;9.96
21.129.472-0;Constanza Isidora Muñoz Vergara;FEMENINO;1983/4/12;42;B;9235809;0.61
16.756.695-0;Ramón Francisco Vergara López;MASCULINO;1993/6/5;32;E;3746099;0.35
18.302.609-7;Rodrigo Pablo González Rodríguez;MASCULINO;1964/1/15;61;E;1522012;6.71
19.668.957-4;;FEMENINO;1967/12/25;58;A;1758881;5.22
4.832.679-7;Rodrigo Francisco Rodríguez Rodríguez;MASCULINO;1997/8/20;28;D;6614930;2.8
15.606.363-7;Juan Pablo González Valenzuela;MASCULINO;2000/4/15;25;A;6590330;6.48
18.182.266-6;;MASCULINO;1994/8/25;31;B;4336220;2.24
15.722.341-4;Constanza Constanza Valenzuela Valenzuela;FEMENINO;1994/2/11;31;A;2751045;5.15
18.848.537-5;Juan Javier Ruiz Robles;MASCULINO;1962/7/9;63;A;4884371;1.56
20.080.884-9;Isabel Isidora Ruiz Díaz;FEMENINO;1991/3/14;34;C;3537181;2.32
15.254.512-7;Ramón Felipe Rojas Robles;MASCULINO;1982/3/10;43;B;8949396;0.11
18.506.617-0;Bernardo Rodrigo Marín Saavedra;MASCULINO;1981/9/15;44;C;5886538;5.74
11.760.673-5;Ignacio Pedro Vergara Valenzuela;MASCULINO;1978/10/1;47;B;788480;1.24
12.337.676-1;Javier Ramón Díaz Campos;MASCULINO;1986/9/17;39;E;6493510;4.23
19.485.783-6;Bernardo Alejandro Robles Robles;MASCULINO;1985/6/13;40;E;2514669;6.13
9.256.737-2;Alejandro Gabriel Vergara Díaz;MASCULINO;1979/2/0;46;E;2615723;8.13
8.723.182-5;Isidora Victoria Rodríguez Vergara;FEMENINO;1977/7/16;48;A;8315347;1.61
16.144.776-5;Javier Gabriel Saavedra Díaz;MASCULINO;1999/9/16;26;E;4999109;0.0
16.217.598-1;Ramón Alejandro Robles Díaz;MASCULINO;1988/9/25;37;C;8099784;3.48
8.190.613-7;Ramón Ignacio Robles Díaz;MASCULINO;1960/1/28;65;E;2175886;9.92
19.400.398-1;Isidora Isidora Castro Valenzuela;FEMENINO;1976/7/2;49;D;3674889;5.15
7.501.650-1;Andrés Juan López López;MASCULINO;1972/8/29;53;D;1591409;2.55
7.189.451-8;Juan Juan Quiroga Castro;MASCULINO;1993/2/14;32;D;6192316;0.49
9.319.233-6;Victoria Blanca Saavedra Campos;FEMENINO;1990/10/2;35;E;2378729;8.52
6.955.173-9;Andrea Blanca Ruiz Saavedra;FEMENINO;1961/11/5;64;D;8724454;2.93
17.625.518-0;;FEMENINO;1991/9/14;34;A;5814472;1.61
20.897.112-0;Francisco Ignacio Valenzuela Ruiz;MASCULINO;1977/8/1;48;E;2546919;1.74
10.534.364-4;Javiera Andrea Marín Rodríguez;FEMENINO;1975/7/11;50;D;5940760;2.74
18.713.345-5;Alejandro Gabriel Robles Marín;MASCULINO;1985/2/4;40;D;6797700;4.22
5.479.984-1;Blanca Isabel López Robles;FEMENINO;1967/10/20;58;A;4870437;5.87
20.070.181-8;Pablo Pedro Campos Castro;MASCULINO;1963/6/17;62;A;6452828;8.11
16.889.773-6;Vicente Juan González Campos;MASCULINO;1979/6/10;46;A;8981063;2.31
11.659.428-2;Felipe Pedro Rodríguez Castro;MASCULINO;1975/3/11;50;D;4209060;9.18
5.906.462-7;Gabriel Juan Muñoz López;MASCULINO;1982/4/28;43;D;7725482;2.66
11.913.595-6;Pedro Francisco López Rojas;MASCULINO;1978/7/24;47;E;4602449;4.29
12.380.384-7;Bernardo Felipe Quiroga Rojas;MASCULINO;1969/2/10;56;E;230362;3.99
19.758.256-0;Isabel Daniela Quiroga Castro;FEMENINO;1960/11/8;65;D;9914640;8.94
10.327.154-7;María Javiera Quiroga Robles;FEMENINO;1988/11/25;37;E;7156929;8.79
15.108.818-6;Andrés Francisco Rodríguez Díaz;MASCULINO;1974/11/6;51;D;3639511;8.98
15.503.944-2;Victoria Andrea Rojas Saavedra;FEMENINO;1970/6/0;55;A;9761527;0.28
13.427.704-9;Andrés Vicente Rodríguez Castro;MASCULINO;1989/4/22;36;C;288841;2.79
5.662.995-1;María Ignacia López Saavedra;FEMENINO;1965/8/21;60;B;4318812;8.57
13.125.987-9;Francisco Felipe Saavedra Rojas;MASCULINO;1983/1/9;42;A;4483335;2.05
13.406.324-4;Alejandro Pablo Díaz Ruiz;MASCULINO;1993/6/19;32;E;1442825;6.89
12.546.516-1;Pablo Bernardo Díaz Rodríguez;MASCULINO;1972/7/24;53;C;5021265;7.58
13.287.268-5;Ignacio Ignacio Rodríguez Robles;MASCULINO;1998/4/12;27;A;366364;3.14
17.164.734-1;Paula Cecilia Díaz Robles;FEMENINO;1994/11/27;31;A;7197385;3.52
16.060.446-3;Juan Ignacio Rodríguez Ruiz;MASCULINO;1977/4/29;48;C;9465982;6.68
15.341.678-7;María Valeria Rojas Díaz;FEMENINO;1991/6/26;34;B;7390481;2.33
19.251.384-9;Paula Blanca Rodríguez Rojas;FEMENINO;1991/8/18;34;B;1788183;2.95
21.812.825-5;Andrea Victoria Campos Rodríguez;FEMENINO;1964/8/14;61;E;5649584;7.7
10.684.452-3;Vicente Alejandro González Díaz;MASCULINO;1966/9/22;59;B;2294088;6.59
4.765.408-2;Rodrigo Pablo Vergara Campos;MASCULINO;1968/2/17;57;D;378547;8.73
9.490.250-1;Pamela Paula Marín Vergara;FEMENINO;1988/5/16;37;E;1431464;2.88
12.519.079-8;Cecilia Valeria Castro Campos;FEMENINO;1995/3/11;30;A;5456548;1.49
16.379.880-8;Isabel Daniela Campos Díaz;FEMENINO;1970/3/21;55;B;6289916;5.09
11.690.393-4;;MASCULINO;1980/4/2;45;C;2823931;9.2
8.905.210-4;Ignacio Pablo Rodríguez Valenzuela;MASCULINO;1964/1/3;61;D;423469;8.15
20.908.746-8;Andrés Ramón Vergara Rojas;MASCULINO;1987/9/8;38;D;3708057;7.33
19.121.560-8;Blanca María Vergara Díaz;FEMENINO;1972/4/3;53;E;8536685;7.76
19.945.965-9;Juan Francisco Quiroga Díaz;MASCULINO;1990/10/16;35;B;5426798;7.9
19.040.542-7;Pedro Bernardo Vergara Castro;MASCULINO;1993/5/14;32;B;3796193;6.25
6.712.836-5;Pablo Francisco González Rodríguez;MASCULINO;1980/9/22;45;C;9370475;7.14
13.363.849-5;Isabel Cecilia Muñoz Campos;FEMENINO;1969/8/0;56;A;487631;5.06
7.570.508-3;Isidora Andrea Robles López;FEMENINO;1995/7/12;30;A;5093866;4.1
18.410.516-6;Paula Blanca González Díaz;FEMENINO;1986/7/7;39;E;2395413;6.12
14.209.012-1;María Pamela Rodríguez Rodríguez;FEMENINO;1995/4/18;30;C;5466202;5.73
13.437.552-4;Bernardo Vicente Rojas Rodríguez;MASCULINO;1983/7/13;42;D;8319932;1.36
5.248.485-5;Ignacio Alejandro Campos Rojas;MASCULINO;1961/3/21;64;C;4686887;3.26
9.942.695-7;Andrés Ramón Rojas González;MASCULINO;1997/6/26;28;B;9085666;5.92
17.955.613-5;Pamela Valeria Marín Vergara;FEMENINO;1965/9/10;60;C;1958149;3.76
10.631.123-4;Pablo Bernardo Díaz González;MASCULINO;1989/3/11;36;C;1058813;9.21
17.653.497-3;Ramón Pablo Vergara Díaz;MASCULINO;1970/11/2;55;A;4476558;9.49
18.766.392-2;Cecilia Isidora Muñoz Marín;FEMENINO;1988/2/24;37;D;471410;4.24
7.924.897-6;Bernardo Andrés Ruiz Rodríguez;MASCULINO;1984/7/13;41;D;2269776;8.06
20.857.125-1;Pamela Pamela Marín Rodríguez;FEMENINO;1971/1/6;54;E;7574645;5.6
15.703.423-7;Daniela Isabel Díaz Marín;FEMENINO;1983/6/2;42;C;212693;5.8
18.499.549-3;;MASCULINO;1986/1/7;39;A;6337452;3.87
17.586.047-2;Alejandro Juan Robles Saavedra;MASCULINO;1966/5/6;59;B;1744294;2.67
5.918.079-7;Ramón Alejandro Rodríguez Rojas;MASCULINO;2000/11/10;25;D;6491517;9.61
4.731.108-8;Pedro Pedro Vergara Díaz;MASCULINO;1996/4/21;29;D;6993669;6.62
19.916.305-3;Rodrigo Pablo Valenzuela Rojas;MASCULINO;1966/12/5;59;A;5844628;3.3
20.367.461-1;Daniela Valeria Valenzuela Ruiz;FEMENINO;1979/4/20;46;D;9720418;6.4
11.095.439-4;Vicente Alejandro Campos Rodríguez;MASCULINO;1995/10/21;30;C;7396313;8.59
11.171.352-9;Francisco Ignacio Quiroga Vergara;MASCULINO;1994/5/6;31;E;9611826;2.98
18.798.689-3;Ramón Ignacio Quiroga Castro;MASCULINO;1987/3/26;38;D;4397689;6.17
21.918.861-6;;MASCULINO;1965/6/10;60;B;7126423;3.44
12.874.838-7;Isabel María Robles Rodríguez;FEMENINO;1987/8/8;38;B;9971916;2.53
8.150.652-8;Paula Daniela Rojas González;FEMENINO;1975/7/3;50;E;9191022;8.52
17.853.813-4;Isabel Constanza Castro González;FEMENINO;1997/11/26;28;B;8485018;2.86
20.919.409-2;Francisco Pedro González Quiroga;MASCULINO;1989/4/23;36;B;7063746;9.53
8.015.754-1;Pamela Blanca Díaz Rojas;FEMENINO;1975/3/20;50;A;7573969;0.3
9.598.362-3;Ignacia Blanca Rodríguez Rojas;FEMENINO;1981/12/10;44;C;9500540;5.77
13.388.192-0;Paula Andrea González Castro;FEMENINO;1973/12/16;52;D;5198241;3.14
18.807.666-5;Alejandro Pablo Valenzuela Rodríguez;MASCULINO;1980/3/12;45;A;649193;5.3
8.587.156-9;Ignacio Francisco Saavedra Saavedra;MASCULINO;1979/7/19;46;E;6681432;8.65
19.371.118-5;Andrea Paula Marín Marín;FEMENINO;1975/7/30;50;B;1189846;5.98
14.016.958-2;Victoria Paula Robles Ruiz;FEMENINO;1988/9/16;37;A;6953656;4.98
5.439.260-9;Isidora Victoria Castro Rodríguez;FEMENINO;1971/3/12;54;D;6935918;1.76
10.894.692-4;Isabel Paula Muñoz Muñoz;FEMENINO;1977/6/16;48;C;7649429;0.79
15.477.299-9;Victoria Andrea Díaz Rodríguez;FEMENINO;1978/10/0;47;E;7845001;9.66
20.491.949-3;Pamela Javiera González González;FEMENINO;1969/2/26;56;E;4498309;1.0
6.314.615-1;Felipe Juan Quiroga Rodríguez;MASCULINO;1973/6/25;52;A;2733338;3.78
5.142.903-9;Andrés Pablo Rodríguez Valenzuela;MASCULINO;1981/11/22;44;C;3284000;5.79
4.291.380-4;Javier Vicente Díaz Robles;MASCULINO;1979/11/1;46;C;5597395;7.7
4.156.243-8;Blanca Daniela López Vergara;FEMENINO;1972/7/30;53;B;4901139;3.78
21.234.383-2;Constanza María Saavedra Vergara;FEMENINO;1975/4/12;50;A;9275641;4.15
12.879.462-9;Pablo Bernardo Robles Campos;MASCULINO;1975/5/17;50;D;5378293;9.75
7.695.934-6;Constanza Victoria Muñoz Rodríguez;FEMENINO;1961/6/23;64;B;6397074;7.13
15.485.070-8;Andrea Constanza Saavedra Muñoz;FEMENINO;1977/8/0;48;A;6813022;9.59
14.163.555-1;Felipe Pedro López Díaz;MASCULINO;1993/6/17;32;C;7038417;7.83
15.761.351-1;María Javiera Campos Rojas;FEMENINO;1987/11/0;38;B;1814354;7.09
19.563.376-6;Pedro Francisco Ruiz González;MASCULINO;1991/6/0;34;B;782835;4.75
13.101.139-5;Bernardo Ignacio Valenzuela Quiroga;MASCULINO;1982/6/15;43;B;314902;2.65
17.167.929-8;Cecilia Pamela Ruiz Saavedra;FEMENINO;1970/4/29;55;D;5570852;8.69
10.265.232-1;Andrea Isidora Castro Valenzuela;FEMENINO;1964/11/20;61;B;8350986;2.32
21.391.803-6;Cecilia Javiera Muñoz Ruiz;FEMENINO;1987/9/9;38;A;8709753;9.52
4.034.615-1;Cecilia Isabel Rojas Muñoz;FEMENINO;1973/10/12;52;B;5702933;0.02
12.505.457-3;Francisco Alejandro Ruiz Campos;MASCULINO;1993/3/2;32;B;6612259;9.49
18.305.483-0;Vicente Felipe Vergara Saavedra;MASCULINO;1963/6/14;62;E;6374228;1.45
17.815.911-0;Ignacio Alejandro Campos Saavedra;MASCULINO;1994/7/5;31;B;2445484;4.21
4.520.876-5;Ignacio Rodrigo Castro Quiroga;MASCULINO;1996/8/14;29;C;1629556;6.48
12.611.995-6;Rodrigo Juan Vergara González;MASCULINO;1967/9/21;58;D;1830614;6.97
16.631.577-3;Pedro Bernardo Rodríguez Rojas;MASCULINO;1968/8/23;57;A;1460618;9.72
20.105.997-5;Isidora Javiera Marín González;FEMENINO;1966/6/21;59;C;7878236;8.25
5.544.807-2;Cecilia Ignacia Ruiz Saavedra;FEMENINO;1989/12/15;36;D;3332472;4.85
15.518.123-7;Vicente Pablo Muñoz Ruiz;MASCULINO;1975/7/5;50;E;3452463;0.71
15.307.666-5;Valeria Isidora Marín Muñoz;FEMENINO;1990/2/6;35;E;5607985;3.87
16.742.214-7;María Andrea González Quiroga;FEMENINO;1997/2/17;28;C;7584903;6.99
19.236.053-1;Vicente Felipe Quiroga Ruiz;MASCULINO;1972/11/27;53;E;4059164;8.48
6.168.493-8;Francisco Andrés González González;MASCULINO;1992/7/24;33;C;2145547;9.21
14.470.229-9;Valeria Cecilia Rodríguez Campos;FEMENINO;1994/9/27;31;A;3503514;0.22
14.676.855-1;Pedro Gabriel Rodríguez Robles;MASCULINO;1982/5/4;43;C;6771206;2.25
10.882.560-8;;MASCULINO;1996/10/14;29;C;4450956;9.25
5.632.669-2;Alejandro Ignacio Quiroga Robles;MASCULINO;1964/6/3;61;E;2749526;6.41
20.919.758-3;Vicente Rodrigo Rojas Valenzuela;MASCULINO;1991/7/14;34;B;6952128;9.52
15.169.282-6;Ignacio Felipe Díaz Valenzuela;MASCULINO;1965/9/16;60;C;887273;3.19
15.086.649-1;Constanza Isidora Vergara Díaz;FEMENINO;1980/8/2;45;A;1100599;8.05
9.913.773-1;Felipe Rodrigo López Rojas;MASCULINO;1998/5/14;27;E;5258695;3.24
7.797.854-2;Cecilia Valeria López Quiroga;FEMENINO;1993/9/21;32;A;4147183;5.51
10.820.637-1;Felipe Juan González Saavedra;MASCULINO;1989/9/15;36;C;2455594;9.59
21.557.798-8;Pablo Alejandro Rodríguez Rodríguez;MASCULINO;1977/11/2;48;D;5226305;4.86
11.590.940-4;Bernardo Andrés Saavedra González;MASCULINO;1973/9/4;52;A;5661619;3.14
20.630.905-4;Javiera Isabel Quiroga Ruiz;FEMENINO;1982/7/26;43;D;7227349;7.89
9.748.323-0;Ignacio Bernardo Ruiz Marín;MASCULINO;1991/9/0;34;C;8566804;6.69
20.106.267-8;Valeria Blanca Vergara Muñoz;FEMENINO;1976/3/13;49;B;3287187;9.92
16.998.537-4;Bernardo Juan Valenzuela Rojas;MASCULINO;1969/5/24;56;C;7609170;8.46
13.324.165-7;Juan Felipe Robles Robles;MASCULINO;1976/10/26;49;C;7285015;5.58
16.319.295-1;Ignacia Isabel Ruiz Rojas;FEMENINO;1970/9/6;55;D;3524122;9.21
17.699.223-1;Isidora María Muñoz Muñoz;FEMENINO;1985/11/4;40;C;5196886;4.68
15.592.787-2;Juan Pablo Rodríguez Díaz;MASCULINO;1974/11/3;51;D;3245369;6.05
16.912.027-2;Ignacia Blanca Muñoz Ruiz;FEMENINO;1976/11/4;49;D;1058830;3.92
10.013.125-3;Daniela Isidora Marín Quiroga;FEMENINO;1970/5/15;55;B;8716714;2.16
5.301.111-7;Gabriel Alejandro López Campos;MASCULINO;1977/5/19;48;E;7398854;4.01
6.084.274-2;Ramón Juan Rodríguez Vergara;MASCULINO;1973/2/0;52;E;2176257;8.35
21.391.822-8;;FEMENINO;1996/7/30;29;D;4386035;6.36
16.727.381-8;Vicente Ramón Quiroga Marín;MASCULINO;1984/5/19;41;E;7105177;7.17
4.511.219-4;Felipe Felipe López Rojas;MASCULINO;1990/5/14;35;D;4442771;0.91
15.583.189-5;Valeria Paula Campos Rojas;FEMENINO;1973/5/27;52;E;3182595;9.88
14.161.186-3;Javiera Valeria Saavedra López;FEMENINO;1998/12/16;27;E;6257196;2.09
5.318.391-8;Pamela Victoria Marín López;FEMENINO;1966/5/17;59;D;2683908;1.02
5.717.065-0;Juan Pedro Muñoz Vergara;MASCULINO;1981/7/24;44;D;412040;6.63
15.051.249-7;Felipe Gabriel Rodríguez Saavedra;MASCULINO;1974/2/10;51;A;5834452;0.46
6.660.613-4;Ramón Vicente González González;MASCULINO;1987/4/17;38;E;911302;1.14
15.228.457-1;Cecilia Isabel Muñoz Rojas;FEMENINO;1994/9/27;31;A;7474012;8.48
19.411.545-5;Vicente Bernardo Robles Díaz;MASCULINO;1991/7/9;34;B;656400;0.35
14.926.321-3;Javier Pedro Campos Díaz;MASCULINO;1976/12/1;49;D;7602931;4.77
17.733.711-5;Juan Juan López Rodríguez;MASCULINO;1998/3/3;27;E;7009240;3.51
14.926.151-7;Francisco Vicente Valenzuela Robles;MASCULINO;1990/1/18;35;E;6866911;0.67
18.813.539-0;María Isabel Rojas Valenzuela;FEMENINO;1981/5/21;44;A;9820562;9.01
4.236.692-7;Alejandro Pedro Saavedra Rodríguez;MASCULINO;1966/12/20;59;D;4221446;1.51
21.224.899-7;Javier Gabriel Rojas Robles;MASCULINO;1978/3/28;47;B;4229261;5.67
20.479.527-0;;MASCULINO;1986/11/6;39;A;4085628;8.19
5.521.177-0;Constanza Constanza Rojas Vergara;FEMENINO;2000/10/24;25;C;3431180;1.59
13.392.468-9;Felipe Ramón Ruiz Ruiz;MASCULINO;1981/5/29;44;C;9721250;2.2
10.136.064-0;Javiera Valeria Rodríguez Saavedra;FEMENINO;1997/2/23;28;B;5293899;7.84
5.608.796-5;Alejandro Juan Ruiz Rodríguez;MASCULINO;1960/9/1;65;D;1436260;4.99
6.812.275-6;Francisco Alejandro Robles Quiroga;MASCULINO;1960/1/12;65;C;2872649;7.73
4.898.664-7;Isidora Constanza Robles Rodríguez;FEMENINO;1997/2/24;28;A;9354877;4.87
9.583.948-6;Isabel Ignacia González González;FEMENINO;1999/11/3;26;E;7757633;3.44
9.872.260-2;María Isabel Quiroga Campos;FEMENINO;1998/7/13;27;E;648646;6.67
12.492.190-7;Vicente Pablo Campos Campos;MASCULINO;1969/3/5;56;B;8479080;7.03
4.850.362-1;;FEMENINO;1966/11/16;59;A;4305643;6.55
13.593.582-2;Isidora Javiera Rojas Marín;FEMENINO;1965/7/1;60;E;4113448;8.05
17.297.105-2;Valeria Ignacia Muñoz Quiroga;FEMENINO;1971/9/26;54;C;5497486;3.11
19.123.634-2;Blanca Ignacia Marín Rojas;FEMENINO;1971/1/22;54;E;2388805;6.13
16.806.421-3;Javier Gabriel Castro Campos;MASCULINO;1969/7/1;56;C;5235544;5.06
11.217.242-8;Bernardo Ignacio Robles López;MASCULINO;1982/4/19;43;C;1603140;5.21
19.749.077-6;Pamela Constanza Vergara Saavedra;FEMENINO;1972/11/11;53;D;3533962;3.33
7.825.992-8;Andrea Daniela Vergara Rojas;FEMENINO;1961/9/1;64;C;8574331;5.37
4.371.047-7;Ignacio Gabriel Rodríguez González;MASCULINO;1967/8/19;58;A;9758327;3.98
16.594.271-3;Alejandro Alejandro Castro Quiroga;MASCULINO;1980/8/27;45;B;4758454;2.87
5.751.475-2;Javier Vicente González Vergara;MASCULINO;1983/8/17;42;C;7722147;1.93
10.178.517-0;Ramón Felipe López Muñoz;MASCULINO;1964/4/20;61;B;9644742;6.02
4.163.504-3;Isidora Valeria Rojas Quiroga;FEMENINO;1967/2/28;58;C;4986379;2.14
15.475.410-3;Javiera Pamela Robles Ruiz;FEMENINO;1962/2/1;63;D;9910683;2.79
6.117.808-8;Valeria María López Díaz;FEMENINO;1979/9/10;46;D;235226;0.26
9.054.752-9;Cecilia Andrea Campos Castro;FEMENINO;1964/7/27;61;C;2371092;3.28
15.477.790-3;Ramón Javier Rodríguez Castro;MASCULINO;1994/3/28;31;E;2278555;1.16
5.575.604-1;Ignacio Pedro Rojas Marín;MASCULINO;1994/7/4;31;A;8619487;4.55
8.510.044-8;María Isabel López Campos;FEMENINO;1964/12/17;61;D;6209506;9.24
18.653.604-8;Juan Javier Vergara Robles;MASCULINO;1964/2/14;61;A;4267607;4.3
19.172.738-1;Javier Felipe Quiroga Quiroga;MASCULINO;1993/8/13;32;A;9300912;1.62
8.421.896-3;Andrea Andrea Saavedra Díaz;FEMENINO;1989/12/13;36;C;3162790;6.78
10.024.06-4;Pamela Blanca Campos Muñoz;FEMENINO;1985/1/21;40;D;7627543;8.25
9.802.865-5;Javiera Isabel Marín Rojas;FEMENINO;1997/5/29;28;D;7605585;4.79
10.605.116-6;Victoria Isabel Quiroga Castro;FEMENINO;1986/4/2;39;C;9637551;8.23
12.02.400-3;Pamela Andrea Saavedra Ruiz;FEMENINO;1960/3/26;65;C;9539551;4.26
8.349.704-2;Ramón Pedro Quiroga Marín;MASCULINO;1981/4/10;44;D;3654445;6.95
10.998.756-5;Pedro Pablo Robles Rodríguez;MASCULINO;1998/7/14;27;C;8643293;4.64
6.857.712-9;Ignacio Vicente Saavedra Valenzuela;MASCULINO;1997/4/1;28;C;8548229;4.34
18.132.784-2;Juan Vicente Robles Campos;MASCULINO;1960/2/9;65;A;5669755;3.32
8.424.294-3;Blanca Pamela Robles Marín;FEMENINO;1983/8/19;42;C;2947201;6.18
6.342.492-3;María Victoria Castro Valenzuela;FEMENINO;1994/10/21;31;D;2193678;8.28
4.761.213-2;Cecilia Javiera Rodríguez Saavedra;FEMENINO;1977/3/2;48;C;7310481;5.25
18.983.897-0;Blanca Daniela Campos Vergara;FEMENINO;1962/3/13;63;C;5340535;6.71
12.829.371-9;Javier Bernardo Díaz Rojas;MASCULINO;1963/2/28;62;E;5209358;3.23
21.937.564-7;Francisco Javier Díaz Ruiz;MASCULINO;1983/7/16;42;B;4187576;2.99
16.404.920-7;;MASCULINO;1965/4/7;60;D;4608714;7.73
13.864.271-4;María Victoria Marín Ruiz;FEMENINO;1992/1/28;33;A;7351637;8.65
20.818.678-2;Constanza Paula Campos González;FEMENINO;1990/7/30;35;D;2061003;0.67
17.489.282-2;;FEMENINO;1963/1/17;62;B;203140;0.01
14.345.873-3;Rodrigo Ramón Valenzuela Valenzuela;MASCULINO;1974/2/20;51;A;6674797;1.84
16.628.812-9;Andrés Bernardo Robles Valenzuela;MASCULINO;1992/9/0;33;A;5697847;1.92
13.291.083-1;;FEMENINO;1973/12/14;52;E;9503124;0.5
10.516.03-5;Ignacio Felipe Valenzuela Robles;MASCULINO;1971/5/7;54;D;8862971;1.48
9.310.969-8;Andrés Pablo Robles Muñoz;MASCULINO;1994/12/6;31;C;8897253;0.56
21.333.976-4;Pedro Ignacio Rodríguez Díaz;MASCULINO;1989/7/29;36;A;9371377;3.21
21.881.719-3;Victoria Andrea Rodríguez Campos;FEMENINO;1974/1/16;51;D;1583662;3.14
15.810.132-4;Andrés Rodrigo Saavedra Valenzuela;MASCULINO;1998/7/2;27;A;553830;2.88
15.673.08-6;Francisco Pablo López Ruiz;MASCULINO;1983/12/22;42;B;5895440;6.33
7.781.984-0;Valeria Valeria Marín Vergara;FEMENINO;1978/8/27;47;A;9270352;8.98
6.713.491-8;Cecilia Victoria Ruiz Campos;FEMENINO;1987/6/24;38;E;442027;5.41
13.756.637-9;Pedro Rodrigo Quiroga Muñoz;MASCULINO;1963/8/10;62;C;9454066;2.78
15.635.831-1;Gabriel Vicente Saavedra Muñoz;MASCULINO;1972/2/20;53;C;3129608;9.81
16.425.832-0;Javier Pablo Rodríguez Rodríguez;MASCULINO;1991/9/30;34;E;5123956;9.39
15.477.445-3;Isabel Cecilia Marín Rodríguez;FEMENINO;1965/8/0;60;E;1988345;4.05
8.693.046-8;Daniela Pamela Ruiz Saavedra;FEMENINO;1966/10/17;59;D;2110515;3.05
5.975.883-9;Pablo Bernardo Muñoz Robles;MASCULINO;1963/12/23;62;A;3509044;6.16
15.928.646-8;Javiera Blanca Valenzuela Valenzuela;FEMENINO;1969/4/14;56;B;3245694;7.96
11.265.364-4;Pamela Victoria Vergara Ruiz;FEMENINO;1985/5/29;40;E;5228972;0.22
20.153.487-5;Alejandro Ramón Rojas Rodríguez;MASCULINO;1971/9/8;54;B;7917888;5.33
20.025.494-9;Javiera Isabel Robles López;FEMENINO;1997/11/1;28;B;2351779;1.71
15.615.964-8;Juan Rodrigo Vergara Rodríguez;MASCULINO;1999/1/6;26;B;1840301;6.22
18.950.864-6;Blanca María Castro Castro;FEMENINO;1984/1/3;41;E;114838;4.28
10.111.962-1;Blanca Constanza Ruiz Ruiz;FEMENINO;1989/8/30;36;B;100860;5.95
20.706.823-9;Alejandro Alejandro López Muñoz;MASCULINO;1970/7/26;55;C;2380121;0.99
18.311.455-2;Javier Javier Marín Marín;MASCULINO;1981/9/12;44;E;2163817;9.43
18.989.702-9;María María Saavedra Robles;FEMENINO;1968/12/14;57;E;4274147;0.15
16.907.960-8;Javier Alejandro Rodríguez Campos;MASCULINO;1970/7/14;55;D;3884436;0.52
7.658.438-4;Pablo Javier Rodríguez Robles;MASCULINO;1987/5/7;38;B;7841287;2.74
21.965.503-4;Ignacio Pablo Marín Campos;MASCULINO;1985/3/30;40;C;8764281;8.37
9.110.727-2;Rodrigo Francisco Díaz Quiroga;MASCULINO;1969/9/26;56;D;4952764;5.04
13.336.944-3;Isidora Constanza Díaz Saavedra;FEMENINO;1975/5/2;50;B;7639954;6.89
15.573.096-3;Valeria Cecilia Rodríguez Campos;FEMENINO;1967/5/26;58;B;2873444;4.12
8.184.091-1;Alejandro Bernardo Quiroga Díaz;MASCULINO;1989/7/5;36;E;1367208;3.99
16.275.271-2;;FEMENINO;1982/9/4;43;E;264098;6.57
14.343.308-1;Alejandro Pedro Saavedra Rojas;MASCULINO;1982/5/14;43;B;8863688;5.52
21.900.908-5;Ramón Alejandro Rojas Rodríguez;MASCULINO;1995/12/19;30;C;540365;0.3
12.206.988-7;Daniela Daniela Rojas Castro;FEMENINO;1983/2/3;42;A;2010108;8.06
15.947.275-4;Pedro Gabriel Robles López;MASCULINO;1982/8/28;43;E;2775035;0.53
5.260.894-0;Vicente Andrés Marín Quiroga;MASCULINO;1967/6/17;58;B;1545515;9.32
19.328.046-7;Cecilia Ignacia Valenzuela Valenzuela;FEMENINO;1968/6/18;57;B;693550;5.77
21.926.255-3;Paula Pamela Robles Rodríguez;FEMENINO;1980/2/6;45;E;2116340;1.01
5.605.815-3;Pedro Alejandro López González;MASCULINO;1994/7/10;31;B;7718638;5.22
8.085.563-9;Felipe Vicente Vergara López;MASCULINO;1973/7/6;52;A;8472755;5.64
21.171.434-1;Valeria Valeria Campos Ruiz;FEMENINO;1995/2/19;30;E;2996883;2.84
18.398.850-7;Victoria María Campos Vergara;FEMENINO;1987/7/8;38;E;6250548;2.89
13.615.497-8;Andrea Ignacia Valenzuela Rojas;FEMENINO;1991/9/30;34;C;751799;8.23
5.390.869-9;Cecilia Isidora Castro Rodríguez;FEMENINO;1981/12/8;44;C;4430169;5.79
8.510.961-5;Gabriel Gabriel Díaz Robles;MASCULINO;1999/6/1;26;B;9295893;2.55
13.794.094-6;;MASCULINO;1989/7/6;36;B;2258140;7.5
6.221.697-5;Daniela Cecilia Rodríguez Díaz;FEMENINO;1990/5/28;35;E;3649856;9.41
14.670.158-4;Alejandro Rodrigo López Castro;MASCULINO;1998/2/4;27;E;3146684;2.61
4.687.315-9;Daniela Paula Campos Rodríguez;FEMENINO;1969/10/13;56;C;6558997;3.87
16.581.218-1;Daniela Pamela González Díaz;FEMENINO;1968/2/25;57;A;7930605;9.08
21.599.195-2;Juan Vicente Díaz González;MASCULINO;1995/12/4;30;E;556270;8.22
18.180.440-9;Paula Pamela Marín Díaz;FEMENINO;1962/2/13;63;E;3547489;0.28
18.981.763-9;María Constanza Muñoz Rojas;FEMENINO;1989/6/16;36;E;3159319;2.98
10.869.390-7;Felipe Ramón Muñoz González;MASCULINO;1961/3/24;64;B;6879667;3.97
14.096.106-8;Pedro Felipe Marín Quiroga;MASCULINO;1968/5/25;57;B;1443428;5.73
13.635.650-5;Blanca Victoria Castro Castro;FEMENINO;1970/9/22;55;C;3548082;2.04
4.483.722-5;Francisco Francisco Díaz Rojas;MASCULINO;1993/6/13;32;E;5369090;3.32
9.352.893-3;;FEMENINO;1983/3/13;42;B;6065488;4.19
11.346.868-8;;MASCULINO;1961/2/5;64;B;4149258;0.74
16.466.454-3;Isabel Blanca López Castro;FEMENINO;1984/9/20;41;E;5192044;2.06
6.982.206-9;Isabel Daniela Quiroga Castro;FEMENINO;1974/10/16;51;B;3263625;0.03
5.962.344-2;Bernardo Alejandro Robles Valenzuela;MASCULINO;1991/10/27;34;E;3658712;3.79
13.131.218-6;Cecilia Ignacia Valenzuela Rodríguez;FEMENINO;1988/10/25;37;B;9061655;9.86
20.879.614-4;Paula Pamela Rodríguez Saavedra;FEMENINO;1985/10/18;40;A;2420812;1.23
16.514.427-5;Pablo Vicente Ruiz González;MASCULINO;1973/12/24;52;C;856834;5.06
4.05.812-0;Ignacia Pamela Ruiz Campos;FEMENINO;1969/6/29;56;B;1703688;6.18
10.178.326-2;Paula Blanca Vergara González;FEMENINO;1964/2/11;61;D;2957109;1.61
14.365.558-5;Pablo Rodrigo Vergara Muñoz;MASCULINO;1973/8/3;52;C;1851135;7.74
11.630.333-6;Blanca Daniela Ruiz Marín;FEMENINO;1994/2/3;31;E;5966047;2.76
10.346.901-1;Felipe Andrés Saavedra Vergara;MASCULINO;1969/2/28;56;C;2296908;6.69
16.647.828-5;Pedro Rodrigo Díaz Robles;MASCULINO;1991/1/6;34;E;1324506;3.6
17.450.824-9;Francisco Pedro Castro Rodríguez;MASCULINO;1972/4/7;53;B;417066;6.17
15.082.342-9;Gabriel Pedro González Marín;MASCULINO;1971/6/20;54;A;9813661;2.97
11.092.554-9;Valeria Valeria Robles Muñoz;FEMENINO;1981/12/25;44;C;2974612;8.43
15.953.055-5;Francisco Alejandro Quiroga Saavedra;MASCULINO;1975/1/24;50;E;9263568;1.86
16.138.338-6;Ignacio Juan González López;MASCULINO;1969/6/22;56;B;1389045;2.69
5.610.994-9;Ignacio Gabriel Rojas López;MASCULINO;1972/10/27;53;D;6972770;6.94
15.730.019-2;Juan Ignacio González López;MASCULINO;1987/3/8;38;D;7485683;6.85
8.07.017-2;Cecilia Constanza Saavedra Valenzuela;FEMENINO;1973/11/15;52;B;48996;5.38
17.272.856-3;Pamela Pamela Rodríguez Marín;FEMENINO;1965/7/2;60;C;5905492;0.82
12.885.342-0;Javier Juan Campos Vergara;MASCULINO;1985/12/13;40;C;4723390;4.6
20.675.486-3;Juan Pablo López Rodríguez;MASCULINO;1964/6/12;61;C;9811272;7.32
4.233.711-2;Constanza Constanza Quiroga Robles;FEMENINO;1997/7/18;28;C;5358875;3.16
7.793.528-4;;MASCULINO;1999/10/23;26;C;2841969;0.86
14.686.085-2;;MASCULINO;1972/8/29;53;C;9617723;8.72
4.595.213-7;Ignacia Paula Castro Campos;FEMENINO;1999/2/16;26;A;4436490;9.13
5.453.400-3;Ignacio Vicente González Marín;MASCULINO;1975/5/2;50;E;6336264;1.1
13.357.515-7;Javier Juan Rojas Saavedra;MASCULINO;1971/2/28;54;D;8345712;2.14
14.323.320-0;Pamela Javiera Rodríguez López;FEMENINO;1998/5/10;27;B;7973860;7.24
7.770.841-5;Pamela Blanca Marín Rodríguez;FEMENINO;1960/7/21;65;A;2905772;9.63
7.082.423-2;Ramón Bernardo Díaz Rojas;MASCULINO;1970/10/7;55;E;2825243;6.17
10.870.629-0;Isabel Cecilia Rodríguez Rodríguez;FEMENINO;1976/2/12;49;B;3185698;7.16
14.948.196-9;Ignacia Paula Vergara Rojas;FEMENINO;1980/3/8;45;E;9266829;2.66
21.109.237-2;Isabel Ignacia Díaz López;FEMENINO;1998/10/21;27;B;992280;3.47
17.565.998-4;Felipe Rodrigo Quiroga González;MASCULINO;1977/10/17;48;D;1679761;4.29
14.213.118-3;Daniela Cecilia Rodríguez Rojas;FEMENINO;1990/5/24;35;D;8997242;7.17
